{
  "$comment": "GENERATED by contracts/codegen/generate.py from release.schema.yaml - DO NOT EDIT.",
  "$schema": "https://json-schema.org/draft/2020-12/schema",
  "additionalProperties": true,
  "description": "Per-episode release metadata Hermes ingests \u2014 the frozen join of sidecar + operational (CONTRACT \u00a74).",
  "properties": {
    "archive": {
      "description": "0/1 \u2014 soft discard (archive bucket, not training set).",
      "type": "integer"
    },
    "bimanual_episode_id": {
      "description": "Shared L/R pairing id (pairs the two wrist cams of one take).",
      "type": "string"
    },
    "body_serial": {
      "description": "Immutable body serial (crosswalk/provenance; \u00a73.4).",
      "type": [
        "string",
        "null"
      ]
    },
    "calibration_id": {
      "description": "Optional calibration reference (scope none/fleet/per_camera; C-11).",
      "type": [
        "string",
        "null"
      ]
    },
    "camera_clock": {
      "description": "PROVENANCE-ONLY; never authoritative (no RTC; poison).",
      "type": [
        "string",
        "null"
      ]
    },
    "camera_firmware": {
      "description": "Insta360 fw.",
      "type": "string"
    },
    "camera_id": {
      "description": "Camera body identity (provenance).",
      "type": "string"
    },
    "capture_stack_id": {
      "description": "Registered capture-stack reference (B-9).",
      "type": [
        "string",
        "null"
      ]
    },
    "decode_skipped": {
      "description": "Status-only: decode skipped.",
      "type": "boolean"
    },
    "display_id": {
      "description": "DERIVED human handle; never a key (\u00a77).",
      "type": "string"
    },
    "episode_id": {
      "description": "UUIDv4 pairing/join key (\u00a77). The ONLY join key.",
      "type": "string"
    },
    "episode_ordinal": {
      "description": "The fob label ordinal.",
      "type": "integer"
    },
    "fob_build": {
      "description": "Fob firmware build.",
      "type": "string"
    },
    "fob_id": {
      "description": "Coordinator fob id.",
      "type": "string"
    },
    "global_episode_seq": {
      "description": "NAND swap-proof ordering spine.",
      "type": "integer"
    },
    "human_label": {
      "description": "Human label (filled post-ingest).",
      "type": [
        "string",
        "null"
      ]
    },
    "ingested_at": {
      "description": "When ingest froze this record (distinct from recorded_at).",
      "type": "string"
    },
    "insv_serial": {
      "description": "The IAQEB .insv serial (crosswalk key; \u00a73.4).",
      "type": [
        "string",
        "null"
      ]
    },
    "kit_id": {
      "description": "The kit (HARD-non-empty).",
      "minLength": 1,
      "type": "string"
    },
    "kit_version": {
      "description": "discardd firmware version.",
      "type": "string"
    },
    "label_source": {
      "description": "Where the label came from (live sidecar vs order-join fallback).",
      "type": "string"
    },
    "modality": {
      "description": "Capture modality (umi today).",
      "enum": [
        "umi",
        "teleop"
      ],
      "type": "string"
    },
    "needs_review": {
      "description": "Flagged for review (identity/pairing disagreement; never silently overwrite, \u00a73.3).",
      "type": "boolean"
    },
    "paired": {
      "description": "Left+right paired (only paired non-void episodes are training/QA-able, \u00a74.2).",
      "type": "boolean"
    },
    "pairing_anomaly": {
      "description": "episode_id pairing disagreed with the ordinal cross-check (C-12).",
      "type": "boolean"
    },
    "pairing_method": {
      "description": "How L/R were paired (C-12).",
      "enum": [
        "episode_id",
        "ordinal_join",
        "needs_review"
      ],
      "type": "string"
    },
    "person_id": {
      "description": "Operator/person id (roster binding as-of recorded_at).",
      "type": "string"
    },
    "person_name": {
      "description": "Operator name (denormalized; PII handling deferred, \u00a78).",
      "type": [
        "string",
        "null"
      ]
    },
    "probe_failed": {
      "description": "Status-only (not quality): ffprobe/decode probe failed.",
      "type": "boolean"
    },
    "prompt": {
      "description": "Task prompt as-of recording.",
      "type": "string"
    },
    "qc_flags": {
      "description": "OPEN set of quality flags (whichever fired); never a closed enum (qc_score.py).",
      "items": {
        "type": "string"
      },
      "type": "array"
    },
    "qc_reasons": {
      "description": "Per-flag human reasons.",
      "items": {
        "type": "string"
      },
      "type": "array"
    },
    "qc_score": {
      "description": "Cohort-relative score (default-ok).",
      "type": [
        "number",
        "null"
      ]
    },
    "record_format_version": {
      "description": "Writer-owned forensic build int (\u00a75).",
      "type": "integer"
    },
    "record_settings": {
      "description": "Resolution/fps/stabilization (3K/100, FlowState off, audio-on).",
      "type": "string"
    },
    "recorded_at": {
      "description": "Fob NTP wallclock (authoritative). Best-effort offline; reliability carried by time_confidence (C-10).",
      "type": "string"
    },
    "recording_suspect": {
      "description": "0/1 \u2014 the did-it-actually-record flag (the no-SD trap).",
      "type": "integer"
    },
    "rotation_id": {
      "description": "Rotation identity.",
      "type": "string"
    },
    "schema": {
      "description": "Schema identifier Hermes pins (\u00a75, anti-drift).",
      "enum": [
        "eunomia-release/v1"
      ],
      "type": "string"
    },
    "session_id": {
      "description": "Shift/session identity.",
      "type": "string"
    },
    "side": {
      "description": "Camera side (HARD-non-empty).",
      "enum": [
        "left",
        "right"
      ],
      "minLength": 1,
      "type": "string"
    },
    "site_id": {
      "description": "Site identity.",
      "type": "string"
    },
    "station_id": {
      "description": "Station identity.",
      "type": "string"
    },
    "sync_confidence": {
      "description": "Audio xcorr score_ratio (>20 solid, 5-15 ok, <5 unreliable).",
      "type": [
        "number",
        "null"
      ]
    },
    "sync_offset_ms": {
      "description": "Cross-cam audio post-sync offset (filled downstream; null at ingest).",
      "type": [
        "number",
        "null"
      ]
    },
    "task_completed": {
      "description": "Whether the task was completed (filled post-ingest).",
      "type": [
        "boolean",
        "null"
      ]
    },
    "task_id": {
      "description": "Task identity.",
      "type": "string"
    },
    "task_name": {
      "description": "Human task name.",
      "type": "string"
    },
    "time_confidence": {
      "description": "Reliability of recorded_at (RTC-ready: add rtc_freewheel later with no schema change, C-10).",
      "enum": [
        "ntp_synced",
        "unsynced_monotonic"
      ],
      "type": "string"
    },
    "void": {
      "description": "Voided by flag. void==true REQUIRES void_reason (cross-field rule, \u00a74.1).",
      "type": "boolean"
    },
    "void_reason": {
      "description": "Why voided (required when void==true; the hand-written overlay rule).",
      "type": [
        "string",
        "null"
      ]
    }
  },
  "required": [
    "schema",
    "episode_id",
    "global_episode_seq",
    "kit_id",
    "side",
    "station_id",
    "task_id",
    "session_id",
    "recorded_at",
    "ingested_at",
    "time_confidence"
  ],
  "title": "Release",
  "type": "object"
}
