{
  "archive": 0,
  "bimanual_episode_id": "bi_88",
  "body_serial": "BODY123",
  "calibration_id": "cal_fleet_1",
  "camera_clock": "2026-06-24T09:59:58Z",
  "camera_firmware": "1.1.6",
  "camera_id": "cam_A",
  "capture_stack_id": "cs_1",
  "decode_skipped": false,
  "display_id": "20260624_op123_5_000012",
  "episode_id": "550e8400-e29b-41d4-a716-446655440000",
  "episode_ordinal": 12,
  "fob_build": "3.8.3",
  "fob_id": "fob_3",
  "global_episode_seq": 1009,
  "human_label": null,
  "ingested_at": "2026-06-24T18:00:00Z",
  "insv_serial": "IAQEBABCD1234",
  "kit_id": "kit_07",
  "kit_version": "discardd-2.0",
  "label_source": "live_sidecar",
  "modality": "umi",
  "needs_review": false,
  "paired": true,
  "pairing_anomaly": false,
  "pairing_method": "episode_id",
  "person_id": "p_99",
  "person_name": "Alex Operator",
  "probe_failed": false,
  "prompt": "fold the towel",
  "qc_flags": [
    "idle"
  ],
  "qc_reasons": [
    "38% idle"
  ],
  "qc_score": 0.82,
  "record_format_version": 3,
  "record_settings": "3K100_fsoff_audioon",
  "recorded_at": "2026-06-24T10:00:00Z",
  "recording_suspect": 0,
  "rotation_id": "r2",
  "schema": "eunomia-release/v1",
  "session_id": "sess_xyz",
  "side": "left",
  "site_id": "mx_1",
  "station_id": "5",
  "sync_confidence": 24.0,
  "sync_offset_ms": 12.5,
  "task_completed": true,
  "task_id": "t_fold",
  "task_name": "Fold the towel",
  "time_confidence": "ntp_synced",
  "void": false,
  "void_reason": null
}
